{"$schema":"https://json-schema.org/draft/2020-12/schema","title":"Decision","type":"object","required":["id","project_id","title","status"],"properties":{"id":{"type":"string"},"project_id":{"type":"string"},"title":{"type":"string"},"context":{"type":"string"},"status":{"type":"string","enum":["draft","active","decided","reviewed"]},"selected_proposal_id":{"type":"string"},"review_date":{"type":"string","format":"date"}}}
